{
  "schemaVersion": 1,
  "id": "psych-hlt3202g-l08-memory",
  "version": "1.0.0",
  "title": {
    "en": "L08 Memory-Guided Saccades",
    "zh": "L08 记忆引导眼跳"
  },
  "questions": [
    {
      "id": "L08-001",
      "type": "single",
      "prompt": {
        "en": "A memory-guided saccade trial has three stages. What is the correct order?",
        "zh": "记忆引导眼跳任务把一次试次分成三个阶段，正确顺序是？"
      },
      "explanation": {
        "en": "The three-stage table on deck p2. See 课件 p2.",
        "zh": "课件 p2 的三阶段表：ENCODE 目标短暂出现、MAINTAIN 目标已不可见、RESPOND go cue 后允许眼跳。延迟把三者分开，使记忆成为必需。见课件 p2。"
      },
      "options": [
        {
          "id": "A",
          "text": {
            "en": "Encode, maintain, respond",
            "zh": "编码 → 维持 → 反应"
          }
        },
        {
          "id": "B",
          "text": {
            "en": "Respond, then maintain, then encode",
            "zh": "反应 → 维持 → 编码"
          }
        },
        {
          "id": "C",
          "text": {
            "en": "Encode, then respond, then maintain",
            "zh": "编码 → 反应 → 维持"
          }
        },
        {
          "id": "D",
          "text": {
            "en": "Maintain, then respond, then encode",
            "zh": "维持 → 反应 → 编码（先记住再动）"
          }
        }
      ],
      "answer": "A",
      "tags": [
        "Memory",
        "延迟眼跳任务"
      ],
      "difficulty": "basic",
      "source": {
        "ref": "S84",
        "pages": [
          2
        ]
      }
    },
    {
      "id": "L08-002",
      "type": "single",
      "prompt": {
        "en": "The saccade endpoint is (8°, 1°) and the target is (10°, 0°). Which describes endpoint error?",
        "zh": "眼跳终点落在 (8°, 1°)，目标在 (10°, 0°)。下列哪一项描述的是「终点误差」？"
      },
      "explanation": {
        "en": "Three definitions are given on deck p3. See 课件 p3.",
        "zh": "课件 p3 给出三个定义：终点/绝对误差＝终点到目标落点的距离；方向误差看角度差；幅度误差看距离差。见课件 p3。"
      },
      "options": [
        {
          "id": "A",
          "text": {
            "en": "The difference between the distance moved and the distance required",
            "zh": "实际移动距离与所需距离之差"
          }
        },
        {
          "id": "B",
          "text": {
            "en": "The angular difference between the actual and target directions",
            "zh": "实际方向与目标方向的角度差"
          }
        },
        {
          "id": "C",
          "text": {
            "en": "The distance from the endpoint to the target location",
            "zh": "终点到目标落点的距离"
          }
        },
        {
          "id": "D",
          "text": {
            "en": "The time from cue onset to saccade onset",
            "zh": "从提示信号到眼跳开始的时间"
          }
        }
      ],
      "answer": "C",
      "tags": [
        "空间误差"
      ],
      "difficulty": "basic",
      "source": {
        "ref": "S84",
        "pages": [
          3
        ]
      }
    },
    {
      "id": "L08-003",
      "type": "single",
      "prompt": {
        "en": "The deck sets the go cue at 0 ms. What does latency refer to?",
        "zh": "课件把 go cue 设为 0 ms。潜伏期（latency）指的是？"
      },
      "explanation": {
        "en": "See 课件 p4.",
        "zh": "课件 p4：LATENCY 是从 go cue 到眼跳开始的时间；ANTICIPATION 是在 go cue 之前就做的眼跳。两者都反映抑制控制功能，但不是同一个指标。见课件 p4。"
      },
      "options": [
        {
          "id": "A",
          "text": {
            "en": "The full time from target onset to target offset",
            "zh": "目标从出现到消失之间所经历的全部时长"
          }
        },
        {
          "id": "B",
          "text": {
            "en": "From the go cue to saccade onset",
            "zh": "从 go cue 到眼跳开始"
          }
        },
        {
          "id": "C",
          "text": {
            "en": "How long a saccade lasts from onset to offset",
            "zh": "一次眼跳从启动到结束所花的时间"
          }
        },
        {
          "id": "D",
          "text": {
            "en": "How long the saccade itself lasts",
            "zh": "一次眼跳本身持续多久"
          }
        }
      ],
      "answer": "B",
      "tags": [
        "Latency 潜伏期"
      ],
      "difficulty": "basic",
      "source": {
        "ref": "S84",
        "pages": [
          4
        ]
      }
    },
    {
      "id": "L08-004",
      "type": "single",
      "prompt": {
        "en": "Under the deck's key question, how is \"I remember drinking coffee with Lin yesterday\" classified?",
        "zh": "「I remember drinking coffee with Lin yesterday.」这类记忆，按课件的判断依据应归为？"
      },
      "explanation": {
        "en": "See the key question column on deck p9. See 课件 p9.",
        "zh": "课件 p9 的判断依据：问「何时、何地发生了什么」对应 Episodic，属 Declarative；问世界事实对应 Semantic；问练习所得对应 Procedural。见课件 p9。"
      },
      "options": [
        {
          "id": "A",
          "text": {
            "en": "Procedural memory, memory of skills and habits",
            "zh": "程序性记忆（技能与习惯）"
          }
        },
        {
          "id": "B",
          "text": {
            "en": "Semantic memory, facts about the world",
            "zh": "语义记忆（关于世界的事实）"
          }
        },
        {
          "id": "C",
          "text": {
            "en": "Nonassociative learning, habituation and sensitization",
            "zh": "非联想学习（习惯化与敏感化）"
          }
        },
        {
          "id": "D",
          "text": {
            "en": "Episodic memory, a form of declarative memory",
            "zh": "情景记忆，属于陈述性记忆"
          }
        }
      ],
      "answer": "D",
      "tags": [
        "记忆类型"
      ],
      "difficulty": "applied",
      "source": {
        "ref": "S84",
        "pages": [
          9
        ]
      }
    },
    {
      "id": "L08-005",
      "type": "single",
      "prompt": {
        "en": "In the memory-guided saccade task, what is a saccade made before the go cue called?",
        "zh": "在延迟眼跳任务中，被试在 go cue 之前就朝目标做的眼跳叫什么？"
      },
      "explanation": {
        "en": "See 课件 p4.",
        "zh": "课件 p4：ANTICIPATION 提前眼跳指在 go cue 之前就朝目标做的眼跳，其比例反映抑制控制失败的次数。见课件 p4。"
      },
      "options": [
        {
          "id": "A",
          "text": {
            "en": "Inhibitory saccade",
            "zh": "抑制性眼跳"
          }
        },
        {
          "id": "B",
          "text": {
            "en": "Antisaccade",
            "zh": "反眼跳"
          }
        },
        {
          "id": "C",
          "text": {
            "en": "Anticipation",
            "zh": "提前眼跳"
          }
        },
        {
          "id": "D",
          "text": {
            "en": "Post-delay gaze",
            "zh": "延迟期眼动"
          }
        }
      ],
      "answer": "C",
      "tags": [
        "抑制控制"
      ],
      "difficulty": "basic",
      "source": {
        "ref": "S84",
        "pages": [
          4
        ]
      }
    },
    {
      "id": "L08-006",
      "type": "single",
      "prompt": {
        "en": "The deck groups common metrics into three columns. Which belongs to post-delay eye movement?",
        "zh": "课件把常用指标归成三栏。下列哪一项属于「Post-delay eye movement」关注的内容？"
      },
      "explanation": {
        "en": "See 课件 p5.",
        "zh": "课件 p5：Post-delay eye movement 观察延迟期间能否保持稳定注视，任何偏离都可能反映抑制控制能力或记忆保持的失败。见课件 p5。"
      },
      "options": [
        {
          "id": "A",
          "text": {
            "en": "Whether stable fixation is held during the delay",
            "zh": "延迟期间能否保持稳定注视"
          }
        },
        {
          "id": "B",
          "text": {
            "en": "The distance between the endpoint and the target",
            "zh": "终点与目标落点之间的距离"
          }
        },
        {
          "id": "C",
          "text": {
            "en": "The time from the cue to the start of the saccade",
            "zh": "提示信号到眼跳开始的时间"
          }
        },
        {
          "id": "D",
          "text": {
            "en": "The difference between the distance moved and the distance required",
            "zh": "实际移动距离与所需距离之差"
          }
        }
      ],
      "answer": "A",
      "tags": [
        "指标分类"
      ],
      "difficulty": "basic",
      "source": {
        "ref": "S84",
        "pages": [
          5
        ]
      }
    },
    {
      "id": "L08-007",
      "type": "single",
      "prompt": {
        "en": "The unit opener on p7 asks two questions. What is the first one?",
        "zh": "p7 的单元导入把本课挂到前两课上，并提出了两个追问。其中第一个追问是？"
      },
      "explanation": {
        "en": "See 课件 p7.",
        "zh": "课件 p7 的对照表：前课是感觉记忆与工作记忆，本课追问「已有知识如何参与当前任务？」；第二个追问是「概念之间怎样联系、如何提取？」。见课件 p7。"
      },
      "options": [
        {
          "id": "A",
          "text": {
            "en": "How long do sensory and working memory each last",
            "zh": "感觉记忆与工作记忆分别能保持多久"
          }
        },
        {
          "id": "B",
          "text": {
            "en": "What latency and amplitude each reflect",
            "zh": "眼跳的潜伏期与幅度各自反映什么"
          }
        },
        {
          "id": "C",
          "text": {
            "en": "How much spatial working memory declines in Alzheimer's disease",
            "zh": "阿尔茨海默病患者的空间工作记忆下降多少"
          }
        },
        {
          "id": "D",
          "text": {
            "en": "How does stored knowledge support the current task",
            "zh": "已有知识如何参与当前任务"
          }
        }
      ],
      "answer": "D",
      "tags": [
        "单元导入"
      ],
      "difficulty": "basic",
      "source": {
        "ref": "S84",
        "pages": [
          7
        ]
      }
    },
    {
      "id": "L08-008",
      "type": "boolean",
      "prompt": {
        "en": "During the maintain phase of the memory-guided saccade task, the target is still visible.",
        "zh": "延迟眼跳任务的延迟（MAINTAIN）阶段，目标在屏幕上仍然可见。"
      },
      "explanation": {
        "en": "See 课件 p2.",
        "zh": "课件 p2：MAINTAIN 阶段「目标已不可见」，被试必须在延迟中保持其位置，依赖内部空间记忆表征。见课件 p2。"
      },
      "answer": false,
      "tags": [
        "延迟的作用"
      ],
      "difficulty": "basic",
      "source": {
        "ref": "S84",
        "pages": [
          2
        ]
      }
    }
  ],
  "description": {
    "en": "Post-lecture self-test for L08 part 1 (deck p1-p9).",